{
  "unitNumber": 0,
  "richBodies": true,
  "title": "What are Differential Equations",
  "subtitle": "Builds the core mental model: equations whose unknowns are functions, and why they describe the changing world.",
  "description": "Builds the core mental model: equations whose unknowns are functions, and why they describe the changing world.",
  "atAGlance": {
    "title": "Unit 0 at a Glance: Core Sub-Topics",
    "summary": "This opening unit builds the core mental model of the whole course: a differential equation is an equation whose unknown is a \\emph{function}, tied to its own rates of change. Each sub-topic below sharpens that idea, moving from raw definition toward why these equations describe the changing world.",
    "bullets": [
      {
        "lead": "What are Differential Equations",
        "body": "the unknown is a function, and the equation relates it to its own derivatives."
      },
      {
        "lead": "How Differential Equations Work",
        "body": "what it means for a function to be a solution, and why one equation yields a whole family of curves."
      },
      {
        "lead": "A Tourist's Guide",
        "body": "the vocabulary of order, linearity, ODE versus PDE, and the slope-field picture of a rate law."
      },
      {
        "lead": "Why You Are Learning Them",
        "body": "how laws about rates and forces become equations we can analyze, from growth to cooling."
      }
    ]
  },
  "modules": [
    {
      "id": "0.1",
      "title": "What are Differential Equations",
      "topics": "A \\emph{differential equation} is an equation whose unknown is a function and which relates that function to one or more of its own derivatives. This is the one structural fact that separates it from algebra --- in algebra you solve for a number, but here you solve for a whole function. The \\emph{order} of the equation is simply the highest derivative that appears.",
      "formulas": [
        {
          "title": "Definition and Order",
          "body": "A differential equation links an unknown function $y(x)$ to its derivatives:\n\\[\n    F\\!\\left(x,\\; y,\\; \\frac{dy}{dx},\\; \\frac{d^{2}y}{dx^{2}},\\; \\dots\\right) = 0.\n\\]\nThe \\strong{order} is the highest derivative present. For example,\n$\\dfrac{dy}{dx} = 3y$ is \\emph{first order}, while $\\dfrac{d^{2}y}{dx^{2}} + 4y = 0$\nis \\emph{second order}."
        }
      ],
      "examples": [
        {
          "title": "Worked Example 0.1: Read $\\frac{dy}{dx} = 3y$",
          "setup": "\\strong{Unknown.} The function $y(x)$, not the constant $3$ and not the input $x$.\\\\\n\\strong{Order.} The highest derivative is the first derivative, so the equation\nis first order.\\\\\n\\strong{Reading.} It says: find every function whose rate of change equals three\ntimes its own current value.",
          "steps": []
        }
      ],
      "warning": {
        "title": "Common Pitfall: The Unknown Is a Function, Not a Number",
        "body": "The most common first-week mistake is hunting for a single number, as in\nalgebra. The unknown here is an entire function $y(x)$ --- a rule defined across\nits whole domain. A solution is satisfied at \\emph{every} point, not at one\nisolated value."
      }
    },
    {
      "id": "0.2",
      "title": "How Differential Equations Work",
      "topics": "To \\emph{solve} a differential equation is to find the function --- or family of functions --- that satisfies it for all inputs. You \\emph{check} a candidate by substituting it and its derivatives back in and confirming both sides agree everywhere. Because a first-order equation fixes only the slope at each point and not the starting height, its general solution carries one arbitrary constant, and an initial condition selects one curve from that family.",
      "formulas": [
        {
          "title": "Solution, General versus Particular",
          "body": "A function is a solution when substitution makes the equation hold for all $x$.\nThe \\strong{general solution} of a first-order equation carries one free\nconstant; an \\strong{initial condition} $y(x_0) = y_0$ pins it down:\n\\[\n    y = F(x) + C\n    \\;\\;\\xrightarrow{\\;y(x_0)=y_0\\;}\\;\\;\n    \\text{one particular curve.}\n\\]"
        }
      ],
      "methodology": {
        "title": "Algorithm: Verifying a Candidate Solution",
        "steps": [
          "Compute the derivatives of the candidate that the equation requires.",
          "Substitute the candidate and those derivatives into the equation.",
          "Simplify the left-hand side and the right-hand side independently.",
          "Confirm the two sides are equal as an identity in $x$ --- true for every input, not just one point."
        ]
      },
      "examples": [
        {
          "title": "Worked Example 0.2: Verify $y = e^{2x}$ solves $\\frac{dy}{dx} = 2y$",
          "setup": "\\strong{Step 1.} Differentiate the candidate:\n\\[ \\frac{dy}{dx} = 2e^{2x}. \\]\n\\strong{Step 2.} Compute the right side from the candidate:\n\\[ 2y = 2e^{2x}. \\]\n\\strong{Step 3.} Both sides equal $2e^{2x}$ for all $x$, so $y = e^{2x}$ is a\nsolution.",
          "steps": []
        }
      ]
    },
    {
      "id": "0.3",
      "title": "A Tourist's Guide to Differential Equations",
      "topics": "Before solving anything, you learn to classify. An equation is an \\emph{ordinary} differential equation (ODE) when its unknown depends on a single independent variable, and \\emph{partial} (PDE) when it depends on several. It is \\emph{linear} when the unknown and its derivatives appear only to the first power and are never multiplied together. Geometrically, a first-order equation is a \\emph{slope field} --- a direction mark at every point that solution curves must follow.",
      "formulas": [
        {
          "title": "Classification Vocabulary",
          "body": "\\begin{itemize}[leftmargin=1.4em, itemsep=2pt]\n    \\item \\strong{Order} --- the highest derivative present.\n    \\item \\strong{ODE vs PDE} --- one independent variable versus several.\n    \\item \\strong{Linear} --- $y$ and its derivatives appear to the first power\n          only, with no products such as $y\\,y'$ and no terms like $\\sin y$.\n    \\item \\strong{Slope field} --- the picture $\\dfrac{dy}{dx} = f(x,y)$ paints,\n          assigning a direction to every point of the plane.\n\\end{itemize}"
        }
      ],
      "examples": [
        {
          "title": "Worked Example 0.3: Classify three equations",
          "setup": "\\strong{(a)} $\\dfrac{dy}{dx} + y = x$ --- first order, linear, ODE.\\\\\n\\strong{(b)} $\\dfrac{d^{2}\\theta}{dt^{2}} + \\sin\\theta = 0$ --- second order,\n\\emph{nonlinear} (the $\\sin\\theta$ term), ODE.\\\\\n\\strong{(c)} $\\dfrac{\\partial u}{\\partial t} = \\dfrac{\\partial^{2} u}{\\partial x^{2}}$\n--- a PDE, since $u$ depends on both $t$ and $x$.",
          "steps": []
        }
      ],
      "warning": {
        "title": "Common Pitfall: Order Is Not Term Count or Degree",
        "body": "The order is set \\emph{only} by the highest derivative --- not by the number of\nterms, the size of the coefficients, or the power to which the function is\nraised. The equation $\\left(\\dfrac{dy}{dx}\\right)^{3} = y$ is still\n\\emph{first order}; the cube is a degree, not an order."
      }
    },
    {
      "id": "0.4",
      "title": "Why You Are Learning Differential Equations",
      "topics": "Differential equations are the language of science because most physical laws describe \\emph{how} a quantity changes, which is exactly what a derivative measures. To model a phenomenon you identify the changing quantity and what its rate of change depends on. The same handful of rate laws --- a rate proportional to an amount, or to a difference --- reappear across growth, decay, and cooling.",
      "formulas": [
        {
          "title": "Standard Models",
          "body": "A rate proportional to the current amount gives exponential behavior:\n\\[\n    \\frac{dP}{dt} = kP \\;\\Longrightarrow\\; P(t) = P_{0}e^{kt}\n    \\qquad (k>0 \\text{ grows},\\; k<0 \\text{ decays}).\n\\]\nRadioactive decay and Newton's law of cooling share the structure:\n\\[\n    \\frac{dN}{dt} = -\\lambda N,\n    \\qquad\n    \\frac{dT}{dt} = -k\\,(T - T_{s}).\n\\]\nNewton's second law writes acceleration as a second derivative of position:\n$F = m\\dfrac{d^{2}x}{dt^{2}}$."
        }
      ],
      "examples": [
        {
          "title": "Worked Example 0.4: Set up a growth model",
          "setup": "\\strong{Step 1.} A population whose growth rate is proportional to its size\nobeys\n\\[ \\frac{dP}{dt} = kP. \\]\n\\strong{Step 2.} Check that $P(t) = P_{0}e^{kt}$ fits: its derivative is\n$kP_{0}e^{kt} = kP$, matching the equation, and $P(0) = P_{0}$ sets the initial\nsize. The single rate law captures the whole exponential family.",
          "steps": []
        }
      ]
    }
  ],
  "cheat": {
    "subtitle": "Condensed Cheat Sheet: What are Differential Equations",
    "takeaway": {
      "title": "Unit 0 Key Takeaway",
      "body": "The whole unit rests on one shift in viewpoint --- the unknown is a\n\\highlight{function}, and the equation pins down its\n\\highlight{rate of change}. You \\highlight{verify} a\ncandidate by substituting it and its derivatives and checking both sides agree\nfor all $x$, and you pass from the \\highlight{general solution} to\none particular curve with an \\highlight{initial condition}. Read\nthe structure first --- order, linearity, and what is changing --- and every\nlater technique in the course has a place to land."
    }
  }
}
